{
  "appName": "ScaleBench",
  "coverage": 1,
  "deviceName": "Fixture iOS WMB+",
  "generatedAtMillis": 1785600005000,
  "longGapCount": 0,
  "maxGapMilliseconds": 100,
  "missingSequenceCount": 0,
  "mode": "shot",
  "notes": "Fixture official payload.",
  "p95IntervalMilliseconds": 100,
  "platform": "ios",
  "protocolKind": "weighMyBruPlus",
  "purity": 1,
  "rawPacketCount": 3,
  "recordingId": "33333333-3333-3333-3333-333333333333",
  "rejectedPacketCount": 0,
  "sampleCount": 3,
  "sampleRateHz": 10,
  "schemaVersion": 1,
  "score": 100,
  "scoreIsUpperBound": false,
  "scoreTitle": "Delivery",
  "scoringModelVersion": "standard-1.0.0",
  "scoringProfileName": "ScaleBench Standard v1",
  "valid": true,
  "validityReasons": [],
  "verificationCoveragePercent": 100
}
